{
  "$schema": "../../../schemas/objective_question_source.schema.json",
  "course_id": "collision-pi",
  "section_id": "A",
  "version": "2.0.0",
  "node_quotas": {
    "A1.1": 5,
    "A1.2": 5,
    "A1.3": 4,
    "A2.1": 6,
    "A2.2": 5,
    "A3.1": 8,
    "A3.2": 10,
    "A3.3": 12,
    "A3.4": 8,
    "A3.5": 10,
    "A4.1": 6,
    "A4.2": 10,
    "A4.3": 8,
    "A5.1": 10,
    "A5.2": 4,
    "A6.1": 10,
    "A6.2": 5,
    "A7.1": 5,
    "A7.2": 5,
    "A7.3": 4
  },
  "source_catalog": [
    {
      "id": "video-main",
      "location": "sources/theory/弹性碰撞与π.txt",
      "scope": "Course narrative, collision-and-π setup, learning sequence"
    },
    {
      "id": "openstax-collision",
      "location": "https://openstax.org/books/college-physics/pages/8-4-elastic-collisions-in-one-dimension",
      "scope": "One-dimensional elastic collision, momentum and kinetic-energy equations"
    },
    {
      "id": "openstax-inelastic",
      "location": "https://openstax.org/books/physics/pages/8-3-elastic-and-inelastic-collisions",
      "scope": "Elastic/inelastic distinction and system momentum conditions"
    },
    {
      "id": "openstax-incline",
      "location": "https://openstax.org/books/college-physics-2e/pages/7-3-gravitational-potential-energy",
      "scope": "Gravitational potential energy and speed from height"
    },
    {
      "id": "openstax-spring",
      "location": "https://openstax.org/books/college-physics-2e/pages/7-4-conservative-forces-and-potential-energy",
      "scope": "Hooke-law spring energy and staged energy calculations"
    }
  ],
  "calculation_fixtures": [
    {
      "id": "CAL-A3-EQ-01",
      "node_id": "A3.2",
      "kind": "elastic_1d",
      "m1": 2,
      "m2": 2,
      "u1": -3,
      "u2": 0,
      "expected": {"v1": 0, "v2": -3}
    },
    {
      "id": "CAL-A3-EQ-02",
      "node_id": "A3.2",
      "kind": "elastic_1d",
      "m1": 1,
      "m2": 1,
      "u1": 2,
      "u2": -1,
      "expected": {"v1": -1, "v2": 2}
    },
    {
      "id": "CAL-A3-UN-01",
      "node_id": "A3.3",
      "kind": "elastic_1d",
      "m1": 3,
      "m2": 1,
      "u1": -4,
      "u2": 0,
      "expected": {"v1": -2, "v2": -6}
    },
    {
      "id": "CAL-A3-UN-02",
      "node_id": "A3.3",
      "kind": "elastic_1d",
      "m1": 1,
      "m2": 3,
      "u1": 4,
      "u2": 0,
      "expected": {"v1": -2, "v2": 2}
    },
    {
      "id": "CAL-A3-UN-03",
      "node_id": "A3.3",
      "kind": "elastic_1d",
      "m1": 3,
      "m2": 1,
      "u1": 2,
      "u2": -2,
      "expected": {"v1": 0, "v2": 4}
    },
    {
      "id": "CAL-A3-DP-01",
      "node_id": "A3.5",
      "kind": "elastic_1d",
      "m1": 3,
      "m2": 1,
      "u1": -4,
      "u2": 0,
      "expected": {"v1": -2, "v2": -6, "delta_p1": 6, "delta_p2": -6}
    },
    {
      "id": "CAL-A7-IN-01",
      "node_id": "A7.1",
      "kind": "incline_speed",
      "g": 10,
      "height": 1.25,
      "expected": {"speed": 5}
    },
    {
      "id": "CAL-A7-SP-01",
      "node_id": "A7.2",
      "kind": "spring_compression",
      "mass": 1,
      "speed": 2,
      "k": 100,
      "expected": {"compression": 0.2}
    }
  ],
  "scenarios": [
    {
      "id": "SC-A3-RELATIVE",
      "context": "两小球 A、B 可视为质点，在同一直线轨道上运动。规定向右为正方向；初始时 A 在左、B 在右，碰撞前两球均做匀速直线运动。两球间距减小到零时发生碰撞。",
      "source_refs": ["video-main", "openstax-collision"],
      "questions": [
        {
          "key": "a3-1-relative-01",
          "node_id": "A3.1",
          "question_type": "single_choice",
          "question_style": "scenario",
          "difficulty": 1,
          "event_stage": "initial",
          "variant_axis": "direction",
          "ask": "A 的速度为 +4 m/s，B 的速度为 +1 m/s。碰撞前两球间距怎样变化？",
          "options": [
            {"text": "每秒减小 3 m", "correct": true},
            {"text": "每秒增大 3 m", "correct": false},
            {"text": "每秒减小 5 m", "correct": false},
            {"text": "保持不变", "correct": false}
          ],
          "explanation": "A 在后方且速度更大，间距的变化率为 u_B-u_A=1-4=-3 m/s，所以间距每秒减小 3 m。"
        },
        {
          "key": "a3-1-relative-02",
          "node_id": "A3.1",
          "question_type": "single_choice",
          "question_style": "scenario",
          "difficulty": 2,
          "event_stage": "initial",
          "variant_axis": "direction",
          "ask": "A 的速度为 -1 m/s，B 的速度为 -3 m/s。若轨道足够长，两球是否会碰撞？",
          "options": [
            {"text": "会，因为 B 向左运动得更快，二者每秒接近 2 m", "correct": true},
            {"text": "会，因为两球速度大小之和为 4 m/s", "correct": false},
            {"text": "不会，因为 A 也向左运动", "correct": false},
            {"text": "不会，因为 B 的速度为负", "correct": false}
          ],
          "explanation": "虽然两球都向左，但右侧的 B 速度更负，B 从右侧追近 A；u_A-u_B=(-1)-(-3)=2 m/s，间距会减小。"
        },
        {
          "key": "a3-1-relative-03",
          "node_id": "A3.1",
          "question_type": "single_choice",
          "question_style": "scenario",
          "difficulty": 1,
          "event_stage": "initial",
          "variant_axis": "initial_velocity",
          "ask": "A 的速度为 +2 m/s，B 的速度为 +5 m/s。若二者速度保持不变，最合理的判断是什么？",
          "options": [
            {"text": "两球不会碰撞，间距持续增大", "correct": true},
            {"text": "两球会碰撞，因为都向右", "correct": false},
            {"text": "两球会碰撞，因为 A 位于左侧", "correct": false},
            {"text": "两球间距保持不变", "correct": false}
          ],
          "explanation": "右侧的 B 比左侧的 A 运动得快，u_B-u_A=3 m/s，间距持续增大。"
        },
        {
          "key": "a3-1-relative-04",
          "node_id": "A3.1",
          "question_type": "multiple_choice",
          "question_style": "scenario",
          "difficulty": 2,
          "event_stage": "initial",
          "variant_axis": "initial_velocity",
          "ask": "在 A 始终位于 B 左侧且两球速度保持不变的前提下，哪些速度组合会使两球最终相碰？",
          "options": [
            {"text": "u_A=+3 m/s，u_B=+1 m/s", "correct": true},
            {"text": "u_A=-1 m/s，u_B=-4 m/s", "correct": true},
            {"text": "u_A=+2 m/s，u_B=+2 m/s", "correct": false},
            {"text": "u_A=-3 m/s，u_B=-1 m/s", "correct": false}
          ],
          "explanation": "初始为 A 左 B 右时，只有 u_A>u_B 才会闭合间距。前两组满足，后两组分别保持间距和增大间距。"
        },
        {
          "key": "a3-1-relative-05",
          "node_id": "A3.1",
          "question_type": "multi_blank",
          "question_style": "scenario",
          "difficulty": 2,
          "event_stage": "initial",
          "variant_axis": "observation",
          "ask": "初始时 A 位于 x=0 m，B 位于 x=12 m；u_A=+5 m/s，u_B=+2 m/s。两球将在经过____s 后于 x=____m 处相碰。",
          "blanks": [
            {"id": "time", "accepted_answers": ["4", "4.0"]},
            {"id": "position", "accepted_answers": ["20", "20.0"]}
          ],
          "explanation": "闭合速度为 5-2=3 m/s，碰撞时间 t=12/3=4 s；碰撞位置为 0+5×4=20 m。"
        },
        {
          "key": "a3-1-relative-06",
          "node_id": "A3.1",
          "question_type": "single_choice",
          "question_style": "scenario",
          "difficulty": 2,
          "event_stage": "initial",
          "variant_axis": "direction",
          "ask": "初始间距为 10 m，A 以 +3 m/s 向右运动，B 以 -2 m/s 向左运动。两球经多长时间相碰？",
          "options": [
            {"text": "2 s", "correct": true},
            {"text": "5 s", "correct": false},
            {"text": "10 s", "correct": false},
            {"text": "不会相碰", "correct": false}
          ],
          "explanation": "两球相向运动，闭合速度为 3-(-2)=5 m/s，因此 t=10/5=2 s。"
        },
        {
          "key": "a3-1-relative-07",
          "node_id": "A3.1",
          "question_type": "single_choice",
          "question_style": "scenario",
          "difficulty": 1,
          "event_stage": "initial",
          "variant_axis": "direction",
          "ask": "A 位于 x=-5 m、速度为 -2 m/s，B 位于 x=+5 m、速度为 +1 m/s。若速度不变，两球的运动关系是？",
          "options": [
            {"text": "背向运动，不会碰撞", "correct": true},
            {"text": "相向运动，约 3.3 s 后碰撞", "correct": false},
            {"text": "同向追赶，10 s 后碰撞", "correct": false},
            {"text": "间距不变", "correct": false}
          ],
          "explanation": "A 向左、B 向右，二者分别远离对方，间距以 3 m/s 增大。"
        },
        {
          "key": "a3-1-relative-08",
          "node_id": "A3.1",
          "question_type": "multiple_choice",
          "question_style": "scenario",
          "difficulty": 2,
          "event_stage": "special_case",
          "variant_axis": "model_assumption",
          "ask": "要判断碰撞前做匀速直线运动的 A、B 是否会在有限时间内相碰，必须利用哪些信息？",
          "options": [
            {"text": "两球的初始相对位置", "correct": true},
            {"text": "两球的速度差及方向", "correct": true},
            {"text": "所选坐标原点的具体位置", "correct": false},
            {"text": "两球表面的颜色", "correct": false}
          ],
          "explanation": "能否相碰取决于初始间距能否在相对运动中减到零；平移坐标原点不改变相对位置，颜色也不影响运动。"
        }
      ]
    },
    {
      "id": "SC-A3-EQUAL",
      "context": "两个质量相等的小球 A、B 在光滑水平直轨道上发生一维弹性碰撞。规定向右为正方向，碰撞过程中两球组成的系统所受外力冲量可忽略。对质量相等的一维弹性碰撞，碰后两球交换各自的速度。",
      "source_refs": ["video-main", "openstax-collision"],
      "questions": [
        {
          "key": "a3-2-equal-01",
          "node_id": "A3.2",
          "question_type": "single_choice",
          "question_style": "scenario",
          "difficulty": 1,
          "event_stage": "after_first_collision",
          "variant_axis": "initial_velocity",
          "ask": "碰撞前 A 以速度 +v 运动，B 静止。碰撞后的速度最可能是？",
          "options": [
            {"text": "A 静止，B 的速度为 +v", "correct": true},
            {"text": "A 的速度为 -v，B 静止", "correct": false},
            {"text": "A、B 均以 +v/2 运动", "correct": false},
            {"text": "A、B 均静止", "correct": false}
          ],
          "explanation": "质量相等且为一维弹性碰撞时，两球交换速度；A 把 +v 这一速度状态交给 B。"
        },
        {
          "key": "a3-2-equal-02",
          "node_id": "A3.2",
          "question_type": "single_choice",
          "question_style": "scenario",
          "difficulty": 2,
          "event_stage": "after_first_collision",
          "variant_axis": "direction",
          "ask": "碰撞前 u_A=+4 m/s、u_B=-2 m/s。碰撞后 A、B 的速度分别为？",
          "options": [